{
	"type": [
		"https://eips.ethereum.org/EIPS/eip-8004#registration-v1",
		"https://three.ws/.well-known/3d-agent-card.schema.json"
	],
	"name": "Trinity",
	"description": "The three.ws concierge. Guides you through the platform, launches and trades $three on pump.fun, and lives as a 3D avatar you can talk to.",
	"image": "/avatars/thumbs/default.png",
	"active": true,
	"x402Support": true,
	"services": [
		{
			"name": "web",
			"endpoint": "https://three.ws/agent/trinity",
			"version": "0.1.0"
		}
	],
	"supportedTrust": ["reputation", "validation"],
	"model": {
		"uri": "/avatars/default.glb",
		"format": "gltf-binary",
		"sha256": "3ca13a1e3ad8f57e50266294b823641680dd3f3f174eb4be908ddca7afc0c82a",
		"sizeBytes": 2875236,
		"license": "CC-BY-4.0"
	},
	"manifest": {
		"uri": "./manifest.json",
		"spec": "agent-manifest/0.2"
	}
}
